Article,Text
Article 7.21,"2. The Parties shall encourage the relevant representative professional bodies in their respective territories to jointly develop and provide recommendations on mutual recognition to the Trade Committee, for the purpose of the fulfilment, in whole or in part, by service suppliers and investors in services sectors, of the criteria applied by each Party for the authorisation, licensing, operation and certification of service suppliers and investors in services sectors and, in particular, professional services, including temporary licensing."
Article 7.21,"3. On receipt of a recommendation referred to in paragraph 2, the Trade Committee shall, within a reasonable time, review the recommendation with a view to determining whether it is consistent with this Agreement."
Article 7.21,"4. When, in conformity with the procedure set out in paragraph 3, a recommendation referred to in paragraph 2 has been found to be consistent with this Agreement and there is a sufficient level of correspondence between the relevant regulations of the Parties, the Parties shall, with a view to implementing that recommendation, negotiate, through their competent authorities, an agreement on mutual recognition (hereinafter referred to as an ""MRA"") of requirements, qualifications, licences and other regulations."
Article 7.22,Transparency and confidential information
Article 7.22,"1. The Parties, through the mechanisms established pursuant to Chapter Twelve (Transparency), shall respond promptly to all requests by the other Party for specific information on:"
Article 7.22,"(a) international agreements or arrangements, including on mutual recognition, which pertain to or affect matters falling under this Chapter; and"
Article 7.22,"(b) standards and criteria for licensing and certification of service suppliers, including information concerning the appropriate regulatory or other body to consult regarding such standards and criteria. Such standards and criteria include requirements regarding education, examination, experience, conduct and ethics, professional development and re-certification, scope of practice, local knowledge and consumer protection."
Article 7.22,"2. Nothing in this Agreement shall require any Party to provide confidential information, the disclosure of which would impede law enforcement, or otherwise be contrary to the public interests, or which would prejudice legitimate commercial interests of particular enterprises, public or private."
Article 7.22,"3. Each Party’s regulatory authorities shall make publicly available the requirements, including any documentation required, for completing applications relating to the supply of services."
Article 7.22,"4. On the request of an applicant, a Party’s regulatory authority shall inform the applicant of the status of its application. If the authority requires additional information from the applicant, it shall notify the applicant without undue delay."
Article 7.22,"5. On the request of an unsuccessful applicant, a regulatory authority that has denied an application shall, to the extent possible, inform the applicant of the reasons for denial of the application."
Article 7.22,"6. A Party’s regulatory authority shall make an administrative decision on a completed application of an investor or a cross-border service supplier of the other Party relating to the supply of a service within 120 days, and shall promptly notify the applicant of the decision. An application shall not be considered complete until all relevant hearings are held and all necessary information is received. Where it is not possible for a decision to be made within 120 days, the regulatory authority shall notify the applicant without undue delay and shall endeavour to make the decision within a reasonable period of time thereafter."
Article 7.23,"1. Where authorisation is required for the supply of a service or for establishment on which a specific commitment has been made, the competent authorities of a Party shall, within a reasonable period of time after the submission of an application considered complete under domestic laws and regulations, inform the applicant of the decision concerning the application. At the request of the applicant, the competent authorities of the Party shall provide, without undue delay, information concerning the status of the application."
Article 7.23,"2. Each Party shall institute or maintain judicial, arbitral or administrative tribunals or procedures which provide, at the request of an affected investor or service supplier, for a prompt review of, and where justified, appropriate remedies for, administrative decisions affecting establishment, cross-border supply of services or temporary presence of natural persons for business purpose. Where such procedures are not independent of the agency entrusted with the administrative decision concerned, the Parties shall ensure that the procedures in fact provide for an objective and impartial review."
Article 7.23,"3. With a view to ensuring that measures relating to qualification requirements and procedures, technical standards and licensing requirements do not constitute unnecessary barriers to trade in services, while recognising the right to regulate and to introduce new regulations on the supply of services in order to meet public policy objectives, each Party shall endeavour to ensure, as appropriate for individual sectors, that such measures are:"
Article 7.23,"(a) based on objective and transparent criteria, such as competence and the ability to supply the service; and"
Article 7.23,"(b) in the case of licensing procedures, not in themselves a restriction on the supply of the service."
Article 7.24,"Each Party shall, to the extent practicable, ensure that internationally agreed standards for regulation and supervision in the financial services sector and for the fight against tax evasion and avoidance are implemented and applied in its territory. Such internationally agreed standards are, inter alia, the Core Principle for Effective Banking Supervision of the Basel Committee on Banking Supervision, the Insurance Core Principles and Methodology, approved in Singapore on 3 October 2003 of the International Association of Insurance Supervisors, the Objectives and Principles of Securities Regulation of the International Organisation of Securities Commissions, the Agreement on Exchange of Information on Tax Matters of the Organisation for Economic Cooperation and Development (hereinafter referred to as the ""OECD""), the Statement on Transparency and Exchange of Information for Tax Purposes of the G20, and the Forty Recommendations on Money Laundering and Nine Special Recommendations on Terrorist Financing of the Financial Action Task Force."
Article 7.25,"1. In liberalising trade in computer services in accordance with Sections B through D, the Parties subscribe to the understanding set out in the following paragraphs."
Article 7.25,"2. CPC [30] 84, the United Nations code used for describing computer and related services, covers the basic functions used to provide all computer and related services including computer programs defined as the sets of instructions required to make computers work and communicate (including their development and implementation), data processing and storage, and related services, such as consultancy and training services for staff of clients. Technological developments have led to the increased offering of these services as a bundle or package of related services that can include some or all of these basic functions. For example, services such as web or domain hosting, data mining services and grid computing consist of a combination of basic computer services functions respectively."
Article 7.25,"3. Computer and related services, regardless of whether they are delivered via a network, including the Internet, include all services that provide:"
Article 7.25,"(a) consulting, strategy, analysis, planning, specification, design, development, installation, implementation, integration, testing, debugging, updating, support, technical assistance or management of or for computers or computer systems;"
Article 7.25,"(b) computer programs plus consulting, strategy, analysis, planning, specification, design, development, installation, implementation, integration, testing, debugging, updating, adaptation, maintenance, support, technical assistance, management or use of or for computer programs;"
Article 7.25,"(c) data processing, data storage, data hosting or database services;"
Article 7.25,"(d) maintenance and repair services for office machinery and equipment, including computers; or"
Article 7.25,"(e) training services for staff of clients, related to computer programs, computers or computer systems, and not elsewhere classified."
Article 7.25,"4. Computer and related services enable the provision of other services such as banking by both electronic and other means. The Parties recognise that there is an important distinction between the enabling service such as web-hosting or application hosting and the content or core service that is being delivered electronically such as banking, and that in such cases the content or core service is not covered by CPC 84."
Article 7.26,"No later than three years after the entry into force of this Agreement, with a view to ensuring competition in postal and courier services not reserved to a monopoly in each Party, the Trade Committee shall set out the principles of the regulatory framework applicable to those services. Those principles shall aim to address issues such as anti-competitive practices, universal service, individual licences and nature of the regulatory authority [31]."
Article 7.27,"1. This Sub-section sets out the principles of the regulatory framework for the basic telecommunications services [32], other than broadcasting, liberalised pursuant to Sections B through D of this Chapter."
Article 7.27,2. For the purposes of this Sub-section:
Article 7.27,(a) telecommunications services means all services consisting of the transmission and reception of electromagnetic signals and does not cover the economic activity consisting of the provision of content which requires telecommunications for its transport;
Article 7.27,"(b) public telecommunications transport service means any telecommunications service that a Party requires, explicitly or in effect, to be offered to the public generally;"
Article 7.27,(c) public telecommunications transport network means the public telecommunications infrastructure which permits telecommunications between and among defined network termination points;
Article 7.27,(d) regulatory authority in the telecommunication sector means the body or bodies charged with the regulation of telecommunications mentioned in this Sub-section;
Article 7.27,(e) essential facilities means facilities of a public telecommunications transport network or service that:
Article 7.27,(i) are exclusively or predominantly provided by a single or limited number of suppliers; and
Article 7.27,(ii) cannot feasibly be economically or technically substituted in order to provide a service;
Article 7.27,(f) major supplier in the telecommunication sector means a supplier that has the ability to materially affect the terms of participation (having regard to price and supply) in the relevant market for telecommunications services as a result of its control over essential facilities or the use of its position in the market;
Article 7.27,"(g) interconnection means linking with suppliers providing public telecommunications transport networks or services in order to allow the users of one supplier to communicate with users of another supplier and to access services provided by another supplier, where specific commitments are undertaken;"
Article 7.27,(h) universal service means the set of services that must be made available to all users in the territory of a Party regardless of their geographical location and at an affordable price [33];
Article 7.27,"(i) end-user means a final consumer of or subscriber to a public telecommunications transport service, including a service supplier other than a supplier of public telecommunications transport services;"
Article 7.27,(j) non-discriminatory means treatment no less favourable than that accorded to any other user of like public telecommunications transport networks or services in like circumstances; and
Article 7.27,"(k) number portability means the ability of end-users of public telecommunications transport services to retain, at the same location, the same telephone numbers without impairment of quality, reliability or convenience when switching between the same category of suppliers of public telecommunications transport services."
Article 7.28,1. A regulatory authority for telecommunications services shall be legally distinct from and functionally independent of any supplier of telecommunications services.
Article 7.28,"2. The regulatory authority shall be sufficiently empowered to regulate the telecommunications services sector. The tasks to be undertaken by a regulatory authority shall be made public in an easily accessible and clear form, in particular where those tasks are assigned to more than one body."
Article 7.28,"3. The decisions of, and the procedures used by, the regulatory authority shall be impartial with respect to all market participants."
Article 7.29,Authorisation to provide telecommunications services
Article 7.29,"1. Provision of services shall, to the extent practicable, be authorised following a simplified authorisation procedure."
Article 7.29,"2. A licence can be required to address issues of attributions of frequencies, numbers and rights of way. The terms and conditions for such licence shall be made publicly available."
Article 7.29,3. Where a licence is required:
Article 7.29,(a) all the licensing criteria and the reasonable period of time normally required to reach a decision concerning an application for a licence shall be made publicly available;
Article 7.29,(b) the reasons for the denial of a licence shall be made known in writing to the applicant upon request; and
Article 7.29,"(c) licence fees [34] required by any Party for granting a licence shall not exceed the administrative costs normally incurred in the management, control and enforcement of the applicable licences [35]."
Article 7.30,Competitive safeguards on major suppliers
Article 7.30,"Appropriate measures shall be maintained for the purpose of preventing suppliers who, alone or together, are a major supplier from engaging in or continuing anti-competitive practices. These anti-competitive practices shall include in particular:"
Article 7.30,(a) engaging in anti-competitive cross-subsidisation [36];
Article 7.30,(b) using information obtained from competitors with anti-competitive results; and
Article 7.30,(c) not making available to other service suppliers on a timely basis technical information about essential facilities and commercially relevant information which are necessary for them to provide services.
Article 7.31,"1. Each Party shall ensure that suppliers of public telecommunications transport networks or services in its territory provide, directly or indirectly within the same territory, to suppliers of public telecommunications transport services of the other Party the possibility to negotiate interconnection. Interconnection should in principle be agreed on the basis of commercial negotiations between the companies concerned."
Article 7.31,2. Regulatory authorities shall ensure that suppliers that acquire information from another undertaking during the process of negotiating interconnection arrangements use that information solely for the purpose for which it was supplied and respect at all times the confidentiality of information transmitted or stored.
Article 7.31,3. Interconnection with a major supplier shall be ensured at any technically feasible point in the network. Such interconnection shall be provided:
Article 7.31,"(a) under non-discriminatory terms, conditions (including technical standards and specifications) and rates, and of a quality no less favourable than that provided for its own like services, for like services of non-affiliated service suppliers or for like services of its subsidiaries or other affiliates;"
Article 7.31,"(b) in a timely fashion, on terms and conditions (including technical standards and specifications) and at cost-oriented rates that are transparent, reasonable, having regard to economic feasibility, and sufficiently unbundled so that the supplier need not pay for network components or facilities that it does not require for the service to be provided; and"
Article 7.31,"(c) upon request, at points in addition to the network termination points offered to the majority of users, subject to charges that reflect the cost of construction of necessary additional facilities."
Article 7.31,4. The procedures applicable for interconnection with a major supplier shall be made publicly available.
Article 7.31,5. Major suppliers shall make publicly available either their interconnection agreements or their reference interconnection offers [37].
Article 7.32,"Each Party shall ensure that suppliers of public telecommunications transport services in its territory, other than suppliers of voice over internet protocol services, provide number portability to the extent technically feasible, and on reasonable terms and conditions."
Article 7.33,Allocation and use of scarce resources
Article 7.33,"1. Any procedures for the allocation and use of scarce resources, including frequencies, numbers and rights of way, shall be carried out in an objective, timely, transparent and non-discriminatory manner."
Article 7.33,"2. The current state of allocated frequency bands shall be made publicly available, but detailed identification of frequencies allocated for specific government uses is not required."
Article 7.34,1. Each Party has the right to define the kind of universal service obligations it wishes to maintain.
Article 7.34,"2. Such obligations will not be regarded as anti-competitive per se, provided they are administered in a transparent, objective and non-discriminatory way. The administration of such obligations shall also be neutral with respect to competition and not be more burdensome than necessary for the kind of universal service defined by each Party."
Article 7.35,Each Party shall ensure the confidentiality of telecommunications and related traffic data by means of a public telecommunications transport network and publicly available telecommunications services without restricting trade in services.
Article 7.36,Resolution of telecommunications disputes
Article 7.36,1. Each Party shall ensure that:
Article 7.36,(a) service suppliers may have recourse to a regulatory authority or other relevant body of the Party to resolve disputes between service suppliers or between service suppliers and users regarding matters set out in this Sub-section; and
Article 7.36,"(b) in the event of a dispute arising between suppliers of public telecommunications transport networks or services in connection with rights and obligations that arise from this Sub-section, a regulatory authority concerned shall, at the request of either party to the dispute issue a binding decision to resolve the dispute in the shortest possible time frame and in any case within a reasonable period of time."
Article 7.36,2. Any service supplier whose legally protected interests are adversely affected by a determination or decision of a regulatory authority:
Article 7.36,"(a) shall have a right to appeal against that determination or decision to an appeal body [38]. Where the appeal body is not judicial in character, written reasons for its determination or decision shall always be given and its determination or decision shall also be subject to review by an impartial and independent judicial authority. Determinations or decisions taken by appeal bodies shall be effectively enforced; and"
Article 7.36,(b) may obtain review of the determination or decision by an impartial and independent judicial authority of the Party. Neither Party may permit an application for judicial review to constitute grounds for non-compliance with the determination or decision of the regulatory authority unless the relevant judicial body stays such determination or decision.
Article 7.37,1. This Sub-section sets out the principles of the regulatory framework for all financial services liberalised pursuant to Sections B through D.
Article 7.37,2. For the purposes of this Sub-section:
Article 7.37,financial services means any service of a financial nature offered by a financial service supplier of a Party. Financial services include the following activities:
Article 7.37,(a) Insurance and insurance-related services:
Article 7.37,(i) direct insurance (including co-insurance):
Article 7.37,(ii) reinsurance and retrocession;
Article 7.37,"(iii) insurance inter-mediation, such as brokerage and agency; and"
Article 7.37,"(iv) services auxiliary to insurance, such as consultancy, actuarial, risk assessment and claim settlement services; and"
Article 7.37,(b) Banking and other financial services (excluding insurance):
Article 7.37,(i) acceptance of deposits and other repayable funds from the public;
Article 7.37,"(ii) lending of all types, including consumer credit, mortgage credit, factoring and financing of commercial transactions;"
Article 7.37,"(iv) all payment and money transmission services, including credit, charge and debit cards, travellers cheques and bankers drafts;"
Article 7.37,(v) guarantees and commitments;
Article 7.37,"(vi) trading for own account or for account of customers, whether on an exchange, in an over-the-counter market or otherwise, the following:"
Article 7.37,"(A) money market instruments (including cheques, bills and certificates of deposits);"
Article 7.37,"(C) derivative products including, but not limited to, futures and options;"
Article 7.37,"(D) exchange rate and interest rate instruments, including products such as swaps, forward rate agreements;"
Article 7.37,(E) transferable securities; and
Article 7.37,"(F) other negotiable instruments and financial assets, including bullion;"
Article 7.37,"(vii) participation in issues of all kinds of securities, including underwriting and placement as agent (whether publicly or privately) and provision of services related to such issues;"
Article 7.37,"(ix) asset management, such as cash or portfolio management, all forms of collective investment management, pension fund management, custodial, depository and trust services;"
Article 7.37,"(x) settlement and clearing services for financial assets, including securities, derivative products and other negotiable instruments;"
Article 7.37,"(xi) provision and transfer of financial information, and financial data processing and related software; and"
Article 7.37,"(xii) advisory, intermediation and other auxiliary financial services on all the activities listed in subparagraphs (i) through (xi), including credit reference and analysis, investment and portfolio research and advice, advice on acquisitions and on corporate restructuring and strategy;"
Article 7.37,financial service supplier means any natural person or juridical person of a Party that seeks to provide or provides financial services and does not include a public entity;
Article 7.37,"(a) a government, a central bank or a monetary authority of a Party or an entity owned or controlled by a Party, that is principally engaged in carrying out governmental functions or activities for governmental purposes, not including an entity principally engaged in supplying financial services on commercial terms; or"
Article 7.37,"(b) a private entity, performing functions normally performed by a central bank or monetary authority, when exercising those functions;"
Article 7.37,"new financial service means a service of a financial nature, including services related to existing and new products or the manner in which a product is delivered, that is not supplied by any financial service supplier in the territory of a Party but which is supplied in the territory of the other Party."
Article 7.38,"1. Each Party may adopt or maintain measures for prudential reasons [40], including:"
Article 7.38,"(a) the protection of investors, depositors, policy-holders or persons to whom a fiduciary duty is owed by a financial service supplier; and"
Article 7.38,(b) ensuring the integrity and stability of the Party’s financial system.
Article 7.38,"2. These measures shall not be more burdensome than necessary to achieve their aim, and where they do not conform to the other provisions of this Agreement, they shall not be used as a means of avoiding each Party’s commitments or obligations under such provisions."
Article 7.38,3. Nothing in this Agreement shall be construed to require a Party to disclose information relating to the affairs and accounts of individual consumers or any confidential or proprietary information in the possession of public entities.
Article 7.38,"4. Without prejudice to other means of prudential regulation of cross-border trade in financial services, a Party may require the registration of cross-border financial service suppliers of the other Party and of financial instruments."
Article 7.39,"The Parties recognise that transparent regulations and policies governing the activities of financial service suppliers are important in facilitating access of foreign financial service suppliers to, and their operations in, each other’s markets. Each Party commits to promoting regulatory transparency in financial services."
