Article,Text
Article 10.18,"3. Having examined a summary of the specifications of the agricultural products and foodstuffs corresponding to the geographical indications of Korea listed in Annex 10-A, which have been registered by Korea under the legislation referred to in paragraph 1, the European Union undertakes to protect the geographical indications of Korea listed in Annex 10-A according to the level of protection laid down in this Chapter."
Article 10.18,"4. Having examined a summary of the specifications of the agricultural products and foodstuffs corresponding to the geographical indications of the European Union listed in Annex 10-A, which have been registered by the European Union under the legislation referred to in paragraph 2, Korea undertakes to protect the geographical indications of the European Union listed in Annex 10-A according to the level of protection laid down in this Chapter."
Article 10.19,"Recognition of specific geographical indications for wines [53], aromatised wines [54] and spirits [55]"
Article 10.19,"1. In Korea, the geographical indications of the European Union listed in Annex 10-B shall be protected for those products which use these geographical indications in accordance with the relevant laws of the European Union on geographical indications."
Article 10.19,"2. In the European Union, the geographical indications of Korea listed in Annex 10-B shall be protected for those products which use these geographical indications in accordance with the relevant laws of Korea on geographical indications."
Article 10.20,"A name protected under this Sub-section may be used by any operator marketing agricultural products, foodstuffs, wines, aromatised wines or spirits conforming to the corresponding specification."
Article 10.24,Addition of geographical indications for protection [57]
Article 10.25,Working Group on Geographical Indications
Article 10.26,Individual applications for protection of geographical indications
Article 10.26,The provisions of this Sub-section are without prejudice to the right to seek recognition and protection of a geographical indication under the relevant legislation of the European Union or Korea.
Article 10.27,Protection of registered designs
Article 10.27,1. The European Union and Korea shall provide for the protection of independently created designs that are new and that are original or have individual character [60].
Article 10.27,"2. This protection shall be provided by registration, and shall confer exclusive rights upon their holders in accordance with this Sub-section."
Article 10.28,Rights conferred by registration
Article 10.28,"The owner of a protected design shall have the right to prevent third parties not having the owner’s consent, at least from making, offering for sale, selling, importing, exporting or using articles bearing or embodying the protected design when such acts are undertaken for commercial purposes, unduly prejudice the normal exploitation of the design, or are not compatible with fair trade practice."
Article 10.29,Protection conferred to unregistered appearance
Article 10.29,"The European Union and Korea shall provide the legal means to prevent the use of the unregistered appearance of a product, only if the contested use results from copying the unregistered appearance of such product [61]. Such use shall at least cover presenting [62], importing or exporting goods."
Article 10.30,1. The duration of protection available in the Parties following registration shall amount to at least 15 years.
Article 10.30,2. The duration of protection available in the European Union and Korea for unregistered appearance shall amount to at least three years.
Article 10.31,"1. The European Union and Korea may provide limited exceptions to the protection of designs, provided that such exceptions do not unreasonably conflict with the normal exploitation of protected designs and do not unreasonably prejudice the legitimate interests of the owner of the protected design, taking account of the legitimate interests of third parties."
Article 10.31,2. Design protection shall not extend to designs dictated essentially by technical or functional considerations.
Article 10.31,3. A design right shall not subsist in a design which is contrary to public policy or to accepted principles of morality.
Article 10.32,A design protected by a design right registered in the European Union or in Korea in accordance with this Sub-section shall also be eligible for protection under the law of copyright applicable in the territory of the Parties as from the date on which the design was created or fixed in any form [63].
Article 10.33,The Parties shall make all reasonable efforts to comply with articles 1 through 16 of the Patent Law Treaty (2000).
Article 10.34,"1. The Parties recognise the importance of the Declaration on the TRIPS Agreement and Public Health, adopted on 14 November 2001 (hereinafter referred to as the ""Doha Declaration"") by the Ministerial Conference of the WTO. In interpreting and implementing the rights and obligations under this Sub-section, the Parties are entitled to rely upon the Doha Declaration."
Article 10.34,"2. Each Party shall contribute to the implementation of and shall respect the Decision of the WTO General Council of 30 August 2003 on paragraph 6 of the Doha Declaration, as well as the Protocol amending the TRIPS Agreement, done at Geneva on 6 December 2005."
Article 10.35,Extension of the duration of the rights conferred by patent protection
Article 10.35,1. The Parties recognise that pharmaceutical products [64] and plant protection products [65] protected by a patent in their respective territories are subject to an administrative authorisation or registration procedure before being put on their markets.
Article 10.35,"2. The Parties shall provide, at the request of the patent owner, for the extension of the duration of the rights conferred by the patent protection to compensate the patent owner for the reduction in the effective patent life as a result of the first authorisation to place the product on their respective markets. The extension of the duration of the rights conferred by the patent protection may not exceed five years [66]."
Article 10.36,Protection of data submitted to obtain a marketing authorisation for pharmaceutical [67] products
Article 10.36,"1. The Parties shall guarantee the confidentiality, non-disclosure of and non-reliance on data submitted for the purpose of obtaining an authorisation to put a pharmaceutical product on the market."
Article 10.37,Protection of data submitted to obtain a marketing authorisation for plant protection products
Article 10.37,1. The Parties shall determine safety and efficacy requirements before authorising the placing on their respective markets of plant protection products.
Article 10.37,"2. The Parties shall ensure that tests, study reports or information submitted for the first time by an applicant to obtain a marketing authorisation for a plant protection product are not used by third parties or relevant authorities for the benefit of any other person aiming at achieving a marketing authorisation for a plant protection product, unless proof of the explicit consent of the first applicant to use these data is provided. This protection will be hereinafter referred to as data protection."
Article 10.37,3. The period of data protection should be at least 10 years starting from the date of the first marketing authorisation in the respective Parties.
Article 10.38,The Parties shall take the necessary measures to ensure full effectiveness of the protection foreseen in this Sub-section and actively cooperate and engage in a constructive dialogue in that regard.
Article 10.39,Each Party shall provide for the protection of plant varieties and comply with the International Convention for the Protection of New Varieties of Plants (1991).
Article 10.40,"Genetic resources, traditional knowledge and folklore"
Article 10.40,"1. Subject to their legislation, the Parties shall respect, preserve and maintain knowledge, innovations and practices of indigenous and local communities embodying traditional lifestyles relevant for the conservation and sustainable use of biological diversity and promote their wider application with the involvement and approval of the holders of such knowledge, innovations and practices and encourage the equitable sharing of the benefits arising from the utilisation of such knowledge, innovations and practices."
Article 10.40,2. The Parties agree to regularly exchange views and information on relevant multilateral discussions:
Article 10.40,"(a) in WIPO, on the issues dealt with in the framework of the Intergovernmental Committee on Genetic Resources, Traditional Knowledge and Folklore;"
Article 10.40,"(b) in the WTO, on the issues related to the relationship between the TRIPS Agreement and the Convention on Biological Diversity (hereinafter referred to as the ""CBD""), and the protection of traditional knowledge and folklore; and"
Article 10.40,"(c) in the CBD, on the issues related to an international regime on access to genetic resources and benefit sharing."
Article 10.41,"1. The Parties reaffirm their commitments under the TRIPS Agreement, and in particular Part III thereof and shall ensure that the following complementary measures, procedures and remedies are available under their legislation so as to permit effective action against any act of infringement of intellectual property rights [68] covered by this Agreement."
Article 10.41,"2. Those measures, procedures and remedies shall:"
Article 10.41,(a) include expeditious remedies to prevent infringements and remedies which constitute a deterrent to further infringements;
Article 10.41,"(c) not be unnecessarily complicated or costly, or entail unreasonable time limits or unwarranted delays; and"
Article 10.41,"(d) be effective, proportionate and dissuasive, and be applied in such a manner as to avoid the creation of barriers to legitimate trade and to provide for safeguards against their abuse."
Article 10.42,"Each Party shall recognise as persons entitled to seek application of the measures, procedures and remedies referred to in this Section and in Part III of the TRIPS Agreement:"
Article 10.42,(a) the holders of intellectual property rights in accordance with the provisions of the applicable law;
Article 10.42,"(b) all other persons authorised to use those rights, in particular licensees, in so far as permitted by, and in accordance with, the provisions of the applicable law;"
Article 10.42,"(c) intellectual property collective rights management bodies which are regularly recognised as having a right to represent holders of intellectual property rights, in so far as permitted by, and in accordance with, the provisions of the applicable law; and"
Article 10.42,"(d) a federation or an association having the legal standing and authority to assert those rights, in so far as permitted by, and in accordance with, the provisions of the applicable law."
Article 10.42,"Civil measures, procedures and remedies"
Article 10.43,"Each Party shall take such measures as necessary, in the case of an infringement of an intellectual property right committed on a commercial scale, to enable the competent judicial authorities to order, where appropriate and following a party’s application, the submission of banking, financial or commercial documents under the control of the opposing party, subject to the protection of confidential information."
Article 10.44,Provisional measures for preserving evidence
Article 10.44,"1. Each Party shall ensure that, even before the commencement of proceedings on the merits of the case, the competent judicial authorities may, on application by a party who has presented reasonably available evidence to support its claims that its intellectual property right has been infringed or is about to be infringed, order prompt and effective provisional measures to preserve relevant evidence in respect of the alleged infringement, subject to the protection of confidential information."
Article 10.44,"2. Each Party may provide that such measures include the detailed description, with or without the taking of samples, or the physical seizure of the infringing goods, and in appropriate cases, the materials and implements used in the production or distribution of these goods and the documents relating thereto. Those measures shall be taken, if necessary without the other party being heard, in particular where any delay is likely to cause irreparable harm to the right holder or where there is a demonstrable risk of evidence being destroyed."
Article 10.45,"1. Each Party shall ensure that, during civil proceedings concerning an infringement of an intellectual property right and in response to a justified and proportionate request of the claimant, the competent judicial authorities may order the infringer and/or any other person which is party to a litigation or a witness therein to provide information on the origin and distribution networks of the goods or services which infringe an intellectual property right."
Article 10.45,"(a) ""Any other person"" in this paragraph means a person who:"
Article 10.45,(i) was found in possession of the infringing goods on a commercial scale;
Article 10.45,(ii) was found to be using the infringing services on a commercial scale;
Article 10.45,(iii) was found to be providing on a commercial scale services used in infringing activities; or
Article 10.45,"(iv) was indicated by the person referred to in this subparagraph as being involved in the production, manufacture or distribution of the goods or the provision of the services."
Article 10.45,"(b) Information shall, as appropriate, comprise:"
Article 10.45,"(i) the names and addresses of the producers, manufacturers, distributors, suppliers and other previous holders of the goods or services, as well as the intended wholesalers and retailers; or"
Article 10.45,"(ii) information on the quantities produced, manufactured, delivered, received or ordered, as well as the price obtained for the goods or services in question."
Article 10.46,Provisional and precautionary measures
Article 10.46,"1. Each Party shall ensure that the judicial authorities may, at the request of the applicant, issue an interlocutory injunction intended to prevent any imminent infringement of an intellectual property right, to forbid, on a provisional basis and subject, where appropriate, to a recurring penalty payment where provided for by its legislation, the continuation of the alleged infringements of that right, or to make such continuation subject to the lodging of guarantees intended to ensure the compensation of the right holder. An interlocutory injunction may also be issued against an intermediary [69] whose services are being used by a third party to infringe copyright, related rights, trademarks or geographical indications."
Article 10.46,2. An interlocutory injunction may also be issued to order the seizure of the goods suspected of infringing an intellectual property right so as to prevent their entry into or movement within the channels of commerce.
Article 10.46,"3. In the case of an infringement committed on a commercial scale, each Party shall ensure that, if the applicant demonstrates circumstances likely to endanger the recovery of damages, the judicial authorities may order the precautionary seizure of the movable and immovable property of the alleged infringer, including the blocking of bank accounts and other assets."
Article 10.47,"1. Each Party shall ensure that the competent judicial authorities may order, at the request of the applicant and without prejudice to any damages to the right holder by reason of the infringement, and without compensation of any sort, destruction of goods that they have found to be infringing an intellectual property right or any other measures to definitively remove those goods from the channels of commerce. If appropriate, the competent judicial authorities may also order destruction of materials and implements principally used in the creation or manufacture of those goods."
Article 10.47,"2. The judicial authorities shall order that those measures be carried out at the expense of the infringer, unless particular reasons are invoked for not doing so."
Article 10.47,"3. In considering a request for corrective measures, the need for proportionality between the seriousness of the infringement and the remedies ordered as well as the interests of third parties shall be taken into account."
Article 10.48,"1. Each Party shall ensure that, where a judicial decision is taken finding an infringement of an intellectual property right, the judicial authorities may issue against the infringer an injunction aimed at prohibiting the continuation of the infringement."
Article 10.48,"2. Where provided for by law, non-compliance with an injunction shall, where appropriate, be subject to a recurring penalty payment, with a view to ensuring compliance. Each Party shall also ensure that right holders are in a position to apply for an injunction against intermediaries [70] whose services are being used by a third party to infringe copyright, related rights, trademarks or geographical indications."
Article 10.50,1. Each Party shall ensure that when the judicial authorities set damages:
Article 10.50,"(a) they shall take into account all appropriate aspects, such as the negative economic consequences, including lost profits, which the injured party has suffered, any unfair profits made by the infringer and, in appropriate cases, elements other than economic factors, such as the moral prejudice caused to the right holder by the infringement; or"
Article 10.50,"(b) as an alternative to subparagraph (a), they may, in appropriate cases, set the damages as a lump sum on the basis of elements such as at least the amount of royalties or fees which would have been due if the infringer had requested authorisation to use the intellectual property right in question."
Article 10.50,"2. Where the infringer did not knowingly, or with reasonable grounds to know, engage in infringing activity, the Parties may provide that the judicial authorities may order the recovery of profits or the payment of damages which may be pre-established."
Article 10.50,"3. In civil judicial proceedings, each Party, at least with respect to works, phonograms, and performances protected by copyright or related rights, and in cases of trademark counterfeiting, may establish or maintain pre-established damages, which shall be available on the election of the right holder."
Article 10.51,"Each Party shall ensure that reasonable and proportionate legal costs and other expenses incurred by the successful party shall as a general rule be borne by the unsuccessful party, unless equity does not allow as such."
Article 10.52,Publication of judicial decisions
Article 10.52,"In cases of infringement of an intellectual property right, each Party shall ensure that the judicial authorities may order, where appropriate, at the request of the applicant and at the expense of the infringer, appropriate measures for the dissemination of the information concerning the decision, including displaying the decision and publishing it in full or in part. Each Party may provide for other additional publicity measures which are appropriate to the particular circumstances, including prominent advertising."
Article 10.53,Presumption of authorship or ownership
Article 10.53,"In civil proceedings involving copyright or related rights, each Party shall provide for a presumption that, in the absence of proof to the contrary, the person or entity whose name is indicated as the author or related right holder of the work or subject matter in the usual manner is the designated right holder in such work or subject matter."
Article 10.54,Each Party shall provide for criminal procedures and penalties to be applied at least in cases of wilful trademark counterfeiting and copyright and related rights [71] piracy on a commercial scale.
Article 10.55,Geographical indications and designs counterfeiting
Article 10.55,"Subject to its national or constitutional law and regulations, each Party shall consider adopting measures to establish the criminal liability for counterfeiting geographical indications and designs."
Article 10.61,Each Party shall ensure that the rights of third parties shall be duly protected and guaranteed.
Article 10.61,Liability of online service providers
Article 10.62,Liability of online service providers [72]
Article 10.63,"Liability of online service providers: ""mere conduit"""
Article 10.63,"1. Where an information society service is provided that consists of the transmission in a communication network of information provided by a recipient of the service, or the provision of access to a communication network, the Parties shall ensure that the service provider is not liable for the information transmitted, on condition that the provider:"
Article 10.63,(a) does not initiate the transmission;
Article 10.63,(b) does not select the receiver of the transmission; and
Article 10.63,(c) does not select or modify the information contained in the transmission.
Article 10.63,"2. The acts of transmission and of provision of access referred to in paragraph 1 include the automatic, intermediate and transient storage of the information transmitted in so far as such storage takes place for the sole purpose of carrying out the transmission in the communication network, and provided that the information is not stored for any period longer than is reasonably necessary for the transmission."
Article 10.64,"Liability of online service providers: ""caching"""
Article 10.64,"1. Where an information society service is provided that consists of the transmission in a communication network of information provided by a recipient of the service, the Parties shall ensure that the service provider is not liable for the automatic, intermediate and temporary storage of that information, performed for the sole purpose of making more efficient the information’s onward transmission to other recipients of the service upon their request, on condition that the provider:"
Article 10.64,(a) does not modify the information;
Article 10.64,(b) complies with conditions on access to the information;
Article 10.64,"(c) complies with rules regarding updating of the information, specified in a manner widely recognised and used by industry;"
Article 10.64,"(d) does not interfere with the lawful use of technology, widely recognised and used by industry, to obtain data on the use of the information; and"
Article 10.64,"(e) acts expeditiously to remove or to disable access to the information it has stored upon obtaining actual knowledge of the fact that the information at the initial source of the transmission has been removed from the network, or access to it has been disabled, or that a judicial or an administrative authority has ordered such removal or disablement."
Article 10.65,"Liability of online service providers: ""hosting"""
Article 10.65,"1. Where an information society service is provided that consists of the storage of information provided by a recipient of the service, the Parties shall ensure that the service provider is not liable for the information stored at the request of a recipient of the service, on condition that the provider:"
Article 10.65,"(a) does not have actual knowledge of illegal activity or information and, as regards claims for damages, is not aware of facts or circumstances from which the illegal activity or information is apparent; or"
Article 10.65,(b) upon obtaining such knowledge or awareness acts expeditiously to remove or to disable access to the information.
Article 10.65,2. Paragraph 1 shall not apply when the recipient of the service is acting under the authority or the control of the provider.
Article 10.66,No general obligation to monitor
Article 10.67,"1. Each Party shall, unless otherwise provided for in this Section, adopt procedures [73] to enable a right holder, who has valid grounds for suspecting that the importation, exportation, re-exportation, customs transit, transhipment, placement under a free zone [74], placement under a suspensive procedure [75] or a bonded warehouse of goods infringing an intellectual property right [76] may take place, to lodge an application in writing with competent authorities, administrative or judicial, for the suspension by the customs authorities of the release into free circulation or the detention of such goods."
Article 10.67,"2. The Parties shall provide that when the customs authorities, in the course of their actions and before an application has been lodged by a right holder or granted, have sufficient grounds for suspecting that goods infringe an intellectual property right, they may suspend the release of the goods or detain them in order to enable the right holder to submit an application for action in accordance with the paragraph 1."
Article 10.67,3. Any rights or obligations established in the implementation of Section 4 of Part III of the TRIPS Agreement concerning the importer shall also be applicable to the exporter or if necessary to the holder [77] of the goods.
Article 10.67,4. Korea shall fully implement the obligation under paragraphs 1 and 2 with respect to subparagraph (c)(i) and (c)(iii) of footnote 27 within two years of the entry into force of this Agreement.
Article 10.68,"(a) the development by trade or professional associations or organisations of codes of conduct aimed at contributing towards the enforcement of intellectual property rights, particularly by recommending the use on optical discs of a code enabling the identification of the origin of their manufacture; and"
