Article,Text
Article 14.9,"2. If there is disagreement between the Parties on the reasonable period of time to comply with the arbitration panel ruling, the complaining Party shall, within 20 days of the notification made under paragraph 1 by the Party complained against, request in writing the original arbitration panel to determine the length of the reasonable period of time. Such request shall be notified to the other Party and to the Trade Committee. The arbitration panel shall issue its ruling to the Parties and to the Trade Committee within 20 days of the date of the submission of the request."
Article 14.10,Review of any measure taken to comply with the arbitration panel ruling
Article 14.10,1. The Party complained against shall notify the complaining Party and the Trade Committee before the end of the reasonable period of time of any measure that it has taken to comply with the arbitration panel ruling.
Article 14.11,Temporary remedies in case of non-compliance
Article 14.12,Review of any measure taken to comply after the suspension of obligations
Article 14.12,1. The Party complained against shall notify the complaining Party and the Trade Committee of any measure it has taken to comply with the ruling of the arbitration panel and of its request for the termination of the suspension of obligations applied by the complaining Party.
Article 14.13,"The Parties may reach a mutually agreed solution to a dispute under this Chapter at any time. They shall notify the Trade Committee of any such solution. Upon notification of the mutually agreed solution, the procedure shall be terminated."
Article 14.14,1. Dispute settlement procedures under this Chapter shall be governed by Annex 14-B.
Article 14.14,2. Any hearing of the arbitration panel shall be open to the public in accordance with Annex 14-B.
Article 14.15,Information and technical advice
Article 14.15,"At the request of a Party, or upon its own initiative, the arbitration panel may obtain information from any source, including the Parties involved in the dispute, as it deems appropriate for the arbitration panel proceeding. The arbitration panel also has the right to seek the relevant opinion of experts as it deems appropriate. Any information obtained in this manner must be disclosed to both Parties which may submit comments. Interested natural or legal persons of the Parties are authorised to submit amicus curiae briefs to the arbitration panel in accordance with Annex 14-B."
Article 14.17,Arbitration panel decisions and rulings
Article 14.17,"1. The arbitration panel shall make every effort to take any decision by consensus. Where, nevertheless, a decision cannot be arrived at by consensus, the matter at issue shall be decided by majority vote. In no case shall dissenting opinions of arbitrators be published."
Article 14.17,"2. Any ruling of the arbitration panel shall be binding on the Parties and shall not create any rights or obligations for natural or legal persons. The ruling shall set out the findings of fact, the applicability of the relevant provisions of this Agreement and the basic rationale behind any findings and conclusions that it makes. The Trade Committee shall make the arbitration panel rulings publicly available in its entirety unless it decides not to do so."
Article 14.18,"1. The Trade Committee shall, no later than six months after the entry into force of this Agreement, establish a list of 15 individuals who are willing and able to serve as arbitrators. Each Party shall propose five individuals to serve as arbitrators. The Parties shall also select five individuals who are not nationals of either Party and shall act as chairperson to the arbitration panel. The Trade Committee will ensure that the list is always maintained at this level."
Article 14.18,"2. Arbitrators shall have specialised knowledge or experience of law and international trade. They shall be independent, serve in their individual capacities and not take instructions from any organisation or government with regard to matters related to the dispute, or be affiliated with the government of any Party, and shall comply with Annex 14-C."
Article 14.19,"1. Recourse to the dispute settlement provisions of this Chapter shall be without prejudice to any action in the WTO framework, including dispute settlement action."
Article 14.19,"2. However, where a Party has, with regard to a particular measure, initiated a dispute settlement proceeding, either under this Chapter or under the WTO Agreement, it may not institute a dispute settlement proceeding regarding the same measure in the other forum until the first proceeding has been concluded. In addition, a Party shall not seek redress of an obligation which is identical under this Agreement and under the WTO Agreement in the two forums. In such case, once a dispute settlement proceeding has been initiated, the Party shall not bring a claim seeking redress of the identical obligation under the other Agreement to the other forum, unless the forum selected fails for procedural or jurisdictional reasons to make findings on the claim seeking redress of that obligation."
Article 14.19,3. For the purposes of paragraph 2:
Article 14.20,"1. All time limits laid down in this Chapter, including the limits for the arbitration panels to issue their rulings, shall be counted in calendar days, the first day being the day following the act or fact to which they refer."
Article 14.20,2. Any time limit referred to in this Chapter may be extended by mutual agreement of the Parties.
Article 14.20,"INSTITUTIONAL, GENERAL AND FINAL PROVISIONS"
Article 15.1,1. The Parties hereby establish a Trade Committee [88] comprising representatives of the EU Party and representatives of Korea.
Article 15.1,"2. The Trade Committee shall meet once a year in Brussels or Seoul alternately or at the request of either Party. The Trade Committee shall be co-chaired by the Minister for Trade of Korea and the Member of the European Commission responsible for Trade, or their respective designees. The Trade Committee shall agree on its meeting schedule and set its agenda."
Article 15.1,(a) ensure that this Agreement operates properly;
Article 15.1,"(b) supervise and facilitate the implementation and application of this Agreement, and further its general aims;"
Article 15.1,"(c) supervise the work of all specialised committees, working groups and other bodies established under this Agreement;"
Article 15.1,(d) consider ways to further enhance trade relations between the Parties;
Article 15.1,"(e) without prejudice to the rights conferred in Chapter Fourteen (Dispute Settlement) and Annex 14-A (Mediation Mechanism for Non-Tariff Measures), seek appropriate ways and methods of forestalling problems which might arise in areas covered by this Agreement, or of resolving disputes that may arise regarding the interpretation or application of this Agreement;"
Article 15.1,(f) study the development of trade between the Parties; and
Article 15.1,(g) consider any other matter of interest relating to an area covered by this Agreement.
Article 15.1,"(a) decide to establish and delegate responsibilities to specialised committees, working groups or other bodies;"
Article 15.1,(b) communicate with all interested parties including private sector and civil society organisations;
Article 15.1,(c) consider amendments to this Agreement or amend provisions of this Agreement in cases specifically provided for in this Agreement;
Article 15.1,(d) adopt interpretations of the provisions of this Agreement;
Article 15.1,(e) make recommendations or adopt decisions as envisaged by this Agreement;
Article 15.1,(f) adopt its own rules of procedure; and
Article 15.1,(g) take such other action in the exercise of its functions as the Parties may agree.
Article 15.1,"5. The Trade Committee shall report to the Joint Committee on its activities and those of its specialised committees, working groups and other bodies at each regular meeting of the Joint Committee."
Article 15.1,"6. Without prejudice to the rights conferred in Chapter Fourteen (Dispute Settlement) and Annex 14-A (Mediation Mechanism for Non-Tariff Measures), either Party may refer to the Trade Committee any issue relating to the interpretation or application of this Agreement."
Article 15.1,"7. When a Party submits information considered as confidential under its laws and regulations to the Trade Committee, specialised committees, working groups or any other bodies, the other Party shall treat that information as confidential."
Article 15.1,"8. Recognising the importance of transparency and openness, the Parties affirm their respective practices of considering the views of members of the public in order to draw on a broad range of perspectives in the implementation of this Agreement."
Article 15.2,1. The following specialised committees are hereby established under the auspices of the Trade Committee:
Article 15.3,1. The following Working Groups are hereby established under the auspices of the Trade Committee:
Article 15.4,"1. The Trade Committee shall, for the purpose of attaining the objectives of this Agreement, have the power to take decisions in respect of all matters in the cases provided by this Agreement."
Article 15.4,"2. The decisions taken shall be binding on the Parties, which shall take the measures necessary to implement the decisions taken. The Trade Committee may also make appropriate recommendations."
Article 15.4,3. The Trade Committee shall draw up its decisions and recommendations by agreement between the Parties.
Article 15.5,"1. The Parties may agree, in writing, to amend this Agreement. An amendment shall enter into force after the Parties exchange written notifications certifying that they have completed their respective applicable legal requirements and procedures, on such date as the Parties may agree."
Article 15.5,"2. Notwithstanding paragraph 1, the Trade Committee may decide to amend the Annexes, Appendices, Protocols and Notes to this Agreement. The Parties may adopt the decision subject to their respective applicable legal requirements and procedures."
Article 15.6,"1. In order to facilitate communication and to ensure the effective implementation of this Agreement, the Parties shall designate coordinators upon the entry into force of this Agreement. The designation of coordinators is without prejudice to the specific designation of competent authorities under specific chapters of this Agreement."
Article 15.6,"2. On the request of either Party, the coordinator of the other Party shall indicate the office or official responsible for any matter pertaining to the implementation of this Agreement and provide the required support to facilitate communication with the requesting Party."
Article 15.6,"3. To the extent possible under its legislation, each Party shall provide information through its coordinators on the request of the other Party and reply promptly to any question from the other Party relating to an actual or proposed measure that might affect trade between the Parties."
Article 15.7,1. This Agreement shall only apply to taxation measures in so far as such application is necessary to give effect to the provisions of this Agreement.
Article 15.7,"2. Nothing in this Agreement shall affect the rights and obligations of either Party under any tax convention between Korea and the respective Member States of the European Union. In the event of any inconsistency between this Agreement and any such convention, that convention shall prevail to the extent of the inconsistency. In the case of a tax convention between Korea and the respective Member States of the European Union, the competent authorities under that convention shall have sole responsibility for jointly determining whether any inconsistency exists between this Agreement and that convention."
Article 15.7,"3. Nothing in this Agreement shall be construed to prevent the Parties from distinguishing, in the application of the relevant provisions of their fiscal legislation, between taxpayers who are not in the same situation, in particular with regard to their place of residence or with regard to the place where their capital is invested."
Article 15.7,4. Nothing in this Agreement shall be construed to prevent the adoption or enforcement of any measure aimed at preventing the avoidance or evasion of taxes pursuant to the tax provisions of agreements to avoid double taxation or other tax arrangements or domestic fiscal legislation.
Article 15.8,"1. Where a Party is in serious balance-of-payments and external financial difficulties, or under threat thereof, it may adopt or maintain restrictive measures with regard to trade in goods, services and establishment."
Article 15.8,2. The Parties shall endeavour to avoid the application of the restrictive measures referred to in paragraph 1.
Article 15.9,Nothing in this Agreement shall be construed:
Article 15.9,"(a) to require any Party to furnish any information, the disclosure of which it considers contrary to its essential security interests;"
Article 15.9,(b) to prevent any Party from taking any action which it considers necessary for the protection of its essential security interests:
Article 15.9,"(i) connected with the production of or trade in arms, munitions or war material or relating to economic activities carried out directly or indirectly for the purpose of provisioning a military establishment;"
Article 15.9,(ii) relating to fissionable and fusionable materials or the materials from which they are derived; or
Article 15.9,(iii) taken in time of war or other emergency in international relations; or
Article 15.9,(c) to prevent any Party from taking any action in order to carry out its international obligations for the purpose of maintaining international peace and security.
Article 15.10,1. This Agreement shall be approved by the Parties in accordance with their own procedures.
Article 15.10,2. This Agreement shall enter into force 60 days after the date the Parties exchange written notifications certifying that they have completed their respective applicable legal requirements and procedures or on such other date as the Parties may agree.
Article 15.10,"3. Notwithstanding paragraphs 2 and 5, the Parties shall apply the Protocol on Cultural Cooperation from the first day of the third month following the date when Korea has deposited its instrument of ratification of the UNESCO Convention on the Protection and Promotion of the Diversity of Cultural Expressions adopted in Paris on 20 October 2005 (hereinafter referred to as the ""UNESCO Convention"") to the UNESCO Secretariat in Paris unless Korea has deposited its instrument of ratification of the UNESCO Convention before the exchange of notifications referred to in paragraphs 2 or 5."
Article 15.10,"4. Notifications shall be sent to the Secretary-General of the Council of the European Union and to the Ministry of Foreign Affairs and Trade of Korea, or its successor."
Article 15.10,5. (a) This Agreement shall be provisionally applied from the first day of the month following the date on which the EU Party and Korea have notified each other of the completion of their respective relevant procedures.
Article 15.10,"(b) In the event that certain provisions of this Agreement cannot be provisionally applied, the Party which cannot undertake such provisional application shall notify the other Party of the provisions which cannot be provisionally applied. Notwithstanding subparagraph (a), provided the other Party has completed the necessary procedures and does not object to provisional application within 10 days of the notification that certain provisions cannot be provisionally applied, the provisions of this Agreement which have not been notified shall be provisionally applied the first day of the month following the notification."
Article 15.10,(c) A Party may terminate provisional application by written notice to the other Party. Such termination shall take effect on the first day of the month following notification.
Article 15.10,"(d) Where this Agreement, or certain provisions thereof, is provisionally applied, the term ""entry into force of this Agreement"" shall be understood to mean the date of provisional application."
Article 15.11,1. This Agreement shall be valid indefinitely.
Article 15.11,2. Either Party may notify in writing the other Party of its intention to denounce this Agreement.
Article 15.11,3. The denunciation shall take effect six months after the notification under paragraph 2.
Article 15.12,1. The Parties shall take any general or specific measures required to fulfil their obligations under this Agreement. They shall see to it that the objectives set out in this Agreement are attained.
Article 15.12,2. Either Party may immediately take appropriate measures in accordance with international law in case of denunciation of this Agreement not sanctioned by the general rules of international law.
Article 15.13,"Annexes, appendices, protocols and notes"
Article 15.13,"The Annexes, Appendices, Protocols and Notes to this Agreement shall form an integral part thereof."
Article 15.14,"1. Unless specified otherwise, previous agreements between the Member States of the European Union and/or the European Community and/or the European Union and Korea are not superseded or terminated by this Agreement."
Article 15.14,2. The present Agreement shall be an integral part of the overall bilateral relations as governed by the Framework Agreement. It constitutes a specific Agreement giving effect to the trade provisions within the meaning of the Framework Agreement.
Article 15.14,3. The Protocol on Mutual Administrative Assistance in Customs Matters supersedes the Customs Agreement with regard to the provisions concerning mutual administrative assistance.
Article 15.14,4. The Parties agree that nothing in this Agreement requires them to act in a manner inconsistent with their obligations under the WTO Agreement.
Article 15.15,"1. This Agreement shall apply, on the one hand, to the territories in which the Treaty on European Union and the Treaty on the Functioning of the European Union are applied and under the conditions laid down in those Treaties, and, on the other hand, to the territory of Korea. References to ""territory"" in this Agreement shall be understood in this sense, unless explicitly stated otherwise."
Article 15.15,"2. As regards those provisions concerning the tariff treatment of goods, this Agreement shall also apply to those areas of the EU customs territory not covered by paragraph 1."
Article 15.16,"This Agreement is drawn up in duplicate in the Bulgarian, Czech, Danish, Dutch, English, Estonian, Finnish, French, German, Greek, Hungarian, Italian, Latvian, Lithuanian, Maltese, Polish, Portuguese, Romanian, Slovak, Slovenian, Spanish, Swedish and Korean languages, each of these texts being equally authentic."
Article 15.16,Съставено в Брюксел на шести октомври две хиляди и десета година.
Article 15.16,"Hecho en Bruselas, el seis de octubre de dos mil diez."
Article 15.16,V Bruselu dne šestého října dva tisíce deset.
Article 15.16,Udfærdiget i Bruxelles den sjette oktober to tusind og ti.
Article 15.16,Geschehen zu Brüssel am sechsten Oktober zweitausendzehn.
Article 15.16,Kahe tuhande kümnenda aasta oktoobrikuu kuuendal päeval Brüsselis.
Article 15.16,"Έγινε στις Βρυξέλλες, στις έξι Οκτωβρίου δύο χιλιάδες δέκα."
Article 15.16,Done at Brussels on the sixth day of October in the year two thousand and ten.
Article 15.16,"Fait à Bruxelles, le six octobre deux mille dix."
Article 15.16,"Fatto a Bruxelles, addì sei ottobre duemiladieci."
Article 15.16,"Briselē, divi tūkstoši desmitā gada sestajā oktobrī."
Article 15.16,Priimta du tūkstančiai dešimtų metų spalio šeštą dieną Briuselyje.
Article 15.16,"Kelt Brüsszelben, a kétezer-tizedik év október hatodik napján."
Article 15.16,"Magħmul fi Brussell, fis- sitt jum ta' Ottubru tas-sena elfejn u għaxra."
Article 15.16,"Gedaan te Brussel, de zesde oktober tweeduizend tien."
Article 15.16,Sporządzono w Brukseli dnia szóstego października roku dwa tysiące dziesiątego.
Article 15.16,"Feito em Bruxelas, em seis de Outubro de dois mil e dez."
Article 15.16,"Întocmit la Bruxelles, la șase octombrie două mii zece."
Article 15.16,V Bruseli dňa šiesteho októbra dvetisícdesať.
Article 15.16,"V Bruslju, dne šestega oktobra leta dva tisoč deset."
Article 15.16,Tehty Brysselissä kuudentena päivänä lokakuuta vuonna kaksituhattakymmenen.
Article 15.16,Som skedde i Bryssel den sjätte oktober tjugohundratio.
Article 15.16,"Deze handtekening verbindt eveneens de Vlaamse Gemeenschap, de Franse Gemeenschap, de Duitstalige Gemeenschap, het Vlaamse Gewest, het Waalse Gewest en het Brussels Hoofdstedelijk Gewest."
Article 15.16,"Cette signature engage également la Communauté française, la Communauté flamande, la Communauté germanophone, la Région wallonne, la Région flamande et la Région de Bruxelles-Capitale."
Article 15.16,"Diese Unterschrift bindet zugleich die Deutschsprachige Gemeinschaft, die Flämische Gemeinschaft, die Französische Gemeinschaft, die Wallonische Region, die Flämische Region und die Region Brüssel-Hauptstadt."
Article 15.16,Für die Bundesrepublik Deutschland
Article 15.16,Pour le Grand-Duché de Luxembourg
Article 15.16,Voor het Koninkrijk der Nederlanden
Article 15.16,W imieniu Rzeczypospolitej Polskiej
Article 15.16,For the United Kingdom of Great Britain and Northern Ireland
Article 15.16,"[1] For the purposes of this Agreement, goods means products as understood in GATT 1994 unless otherwise provided in this Agreement."
Article 15.16,"[2] The Parties understand that this definition is without prejudice to the treatment that the Parties, in line with the WTO Agreement, may accord to trade conducted on a most-favoured-nation basis."
Article 15.16,"[3] A Party may require an importer to provide sufficient guarantee in the form of a surety, a deposit or some other appropriate instruments, covering the ultimate payment of the customs duties, taxes and fees in connection with the importation of the goods."
Article 15.16,[4] The sole fact of requiring a visa for natural persons of certain countries and not for those of others shall not be regarded as nullifying or impairing benefits under the terms of a specific commitment in this Chapter and its Annexes.
Article 15.16,[5] Central administration means the head office where ultimate decision-making takes place.
Article 1,"1. Recalling the obligations of the Parties under the WTO Agreement, in particular the TBT Agreement, and recognising the importance of electronics for growth, employment and trade for each Party, the Parties confirm their shared objectives and principles of:"
Article 1,(a) progressively and simultaneously eliminating tariffs and non-tariff obstacles to bilateral trade;
Article 1,"(b) establishing competitive market conditions based on principles of openness, non-discrimination, proportionality and transparency;"
Article 1,(c) gradually aligning their domestic regulations with existing international standards;
Article 1,"(d) promoting ""one test"" and, where practicable, a supplier’s declaration of conformity through elimination of duplicative and unnecessarily burdensome conformity assessment procedures;"
Article 1,(e) implementing appropriate regulatory and legal enforcement mechanisms related to product liability and market surveillance; and
Article 1,"(f) enhancing cooperation to foster continued mutually beneficial development in trade, as well as to improve product quality with a view to ensuring protection of public health and safety of products."
Article 1,"2. This Annex shall apply to any standard, technical regulation and conformity assessment procedure that either Party may introduce or maintain with respect to the safety and electromagnetic compatibility (hereinafter referred to as ""EMC"") of electrical and electronic equipment, professional electrotechnical equipment, electrical household appliances and consumer electronics defined in Appendix 2-B-1 (hereinafter referred to as ""covered products"")."
Article 2,International standards and standard-setting bodies
Article 2,"1. The Parties recognise that the International Organisation for Standards (hereinafter referred to as the ""ISO""), the International Electrotechnical Commission (hereinafter referred to as the ""IEC"") and the International Telecommunication Union (hereinafter referred to as the ""ITU"") are the relevant international standard-setting bodies for EMC and safety of covered products [1]."
Article 2,"2. Where relevant international standards established by the ISO, IEC and ITU exist, the Parties shall use these international standards or the relevant parts of them as a basis for any standard, technical regulation or conformity assessment procedure [2]."
Article 2,"3. The Parties shall ensure that their standard-setting bodies participate in the development of international standards in the ISO, IEC and ITU, and commit to consult with a view to establishing common approaches."
Article 3,Conformity assessment procedure
Article 3,"In case a Party requires a positive assurance of conformity with technical regulations on EMC or safety of covered products, the following rules shall apply [3]:"
Article 3,"(a) conformity assessment procedures shall not be prepared, adopted or applied with a view to or with the effect of creating unnecessary obstacles to trade with the other Party;"
Article 5,Consolidation and gradual reduction in requirements
